<?xml version="1.0"?>
<!--
Click nbfs://nbhost/SystemFileSystem/Templates/Licenses/license-default.txt to change this license
Click nbfs://nbhost/SystemFileSystem/Templates/XML/XmlSchema.xsd to edit this template
-->

<xs:schema    version="1.0"
              xmlns:xs="http://www.w3.org/2001/XMLSchema"
              elementFormDefault="qualified">

    <xs:element name="fruitStore">
        <xs:complexType>
            <xs:sequence>
                <xs:element name="executives">
                    <xs:complexType>
                        <xs:sequence>
                            <xs:element name="worker" minOccurs="1" maxOccurs="unbounded">
                                <xs:complexType>
                                    <xs:sequence>
                                        <xs:element name="name" minOccurs="1"/>
                                        <xs:element name="surname" minOccurs="1"/>
                                    </xs:sequence>
                                    <xs:attribute name="id_numer">
                                        <xs:simpleType>
                                            <xs:restriction base="xs:integer">
                                                <xs:pattern value="[0-9][0-9][0-9][0-9]"/>
                                            </xs:restriction>
                                        </xs:simpleType>
                                    </xs:attribute>
                                    <xs:attribute name="charge">
                                        <xs:simpleType>
                                            <xs:restriction base="xs:string">
                                                <xs:enumeration value="CEO"/>
                                                <xs:enumeration value="RRHH"/>
                                                <xs:enumeration value="President"/>
                                            </xs:restriction>
                                        </xs:simpleType>
                                    </xs:attribute>
                                </xs:complexType>
                            </xs:element>
                        </xs:sequence>
                    </xs:complexType>
                </xs:element>
                <xs:element name="shops">
                    <xs:complexType>
                        <xs:sequence>
                            <xs:element name="shop" minOccurs="1" maxOccurs="unbounded"> 
                                <xs:complexType>
                                    <xs:sequence>
                                        <xs:element name="workers" minOccurs="1">
                                            <xs:complexType>
                                                <xs:sequence>
                                                    <xs:element name="worker" minOccurs="1" maxOccurs="unbounded">
                                                        <xs:complexType>
                                                            <xs:sequence>
                                                                <xs:element name="name" minOccurs="1"/>
                                                                <xs:element name="surname" minOccurs="1"/>
                                                            </xs:sequence>
                                                            <xs:attribute name="id_numer" type="xs:int"/>
                                                            <xs:attribute name="charge" type="xs:string"/>
                                                            <xs:attribute name="nationality" type="xs:string"/>
                                                        </xs:complexType>
                                                    </xs:element>
                                                </xs:sequence>
                                            </xs:complexType>
                                        </xs:element>
                                    </xs:sequence>
                                    <xs:attribute name="nr" type="xs:int"/>
                                </xs:complexType>
                            </xs:element>
                        </xs:sequence>
                    </xs:complexType>
                </xs:element>
            </xs:sequence>
            <xs:attribute name="name" type="xs:string"/>
        </xs:complexType>
    </xs:element>
</xs:schema>
