<?xml version="1.0" encoding="UTF-8"?>
<!--
Click nbfs://nbhost/SystemFileSystem/Templates/Licenses/license-default.txt to change this license
Click nbfs://nbhost/SystemFileSystem/Templates/XML/XMLDocument.xml to edit this template
-->


<fruitStore name="Defecto Fruta"
            xmlns:xsi="http://www.w3.org/2001/XMLSchema-instance"
            xsi:noNamespaceSchemaLocation="schema1.xsd">
    <executives>
        <worker id_numer="0001" charge="CEO">
            <name>Alan</name>
            <surname>Mikolajczyk</surname>
        </worker>
        <worker id_numer="1001" charge="RRHH">
            <name>Juan</name>
            <surname>Manute</surname>
        </worker>
    </executives>
    <shops>
        <shop nr="1">
            <workers>
                <worker id_numer="1002" charge="cashier" nationality="ES">
                    <name>Jose</name>
                    <surname>Manuel</surname>
                </worker>
                <worker id_numer="1003" charge="dependant" nationality="GB">
                    <name>Pepe</name>
                    <surname>Murray</surname>
                </worker>
            </workers>
        </shop>
        <shop nr="2">
            <workers>
                <worker id_numer="2001" charge="cashier"  nationality="ES">
                    <name>Sara</name>
                    <surname>Socas</surname>
                </worker>
                <worker id_numer="2001" charge="cashier" nationality="ES">
                    <name>Julia</name>
                    <surname>Bastinazo</surname>
                </worker>
                <worker id_numer="2001" charge="dependant" nationality="PL">
                    <name>Sarah</name>
                    <surname>Moew</surname>
                </worker>
            </workers>
        </shop>
        <shop nr="3">
            <workers>
                <worker id_numer="3001" charge="dependant" nationality="ES">
                    <name>Almudena</name>
                    <surname>Tirain</surname>
                </worker>
                <worker id_numer="3001" charge="cashier" nationality="EN">
                    <name>George</name>
                    <surname>Jungle</surname>
                </worker>
            </workers>
        </shop>     
    </shops>
</fruitStore>

